Interview_ID,Stakeholder,Organization,Title,Date,Key_Insight_1,Key_Insight_2,Key_Insight_3,Key_Insight_4,Key_Insight_5,Supported_Hypotheses,Challenged_Hypotheses,Strategic_Value,Follow_Up
21,Arad Gharagozli,Galaxia Mission Systems,Founder & CEO,February 2026,Galaxia actively uses AM in production,Two-sided marketplace model immediately understood (Airbnb for 3D printers),Willing to list own Bambu printer on platform to monetize downtime,IP security & controlled goods = #1 aerospace barrier,Need certified vetted printer operators for aerospace/defence,AM actively used; Two-sided model intuitive; Idle printers monetizable,Platform audit trail alone insufficient for aerospace - need stronger vetting,VERY HIGH - Active AM user; local NS founder; raised critical moat question,"Schedule via Leah ~2 weeks; Prep aerospace IP/controlled goods response; Ask cert standards; Refer defence contacts"
52,Scott Humber & Heather Davis,Aker Solutions,"Senior Manager (Digitalization) & Sr. Project Advisor",February 2026,Real end-to-end AM workflow exists globally,Workflow not yet formalized with Atlantic XL (region too nascent),Formal AM screening process with 6 assessment criteria,Clients use FieldNode (digital inventory) - NOT competitor; different layer,Lloyd's qualifies facility for ALL criticality levels (competitive advantage),Real AM workflow exists; Certification standardizable; OEMs participate if IP protected,None - all validations positive,EXTREMELY HIGH - Client validation; regulatory deep-dive; integration pathway,"Introduce AM expert (Heather Davis); Formalize NL workflow; FieldNode integration"
53,Stephen Ryan,PolyUnity Tech,Co-Founder & CMO,25-Feb-2026,"3-tier platform model: Tier 1 (click-receive service) / Tier 2 (QMS software) / Tier 3 (licensed full platform)","Approval CASCADE eliminates 50% sales friction: once part certified at one operator, all future orgs reuse approval instantly",Multi-stage approval pipeline is product (not print): idea → feasibility → prototype → certification → finance → inventory,IP strategy: own AddManuChain's designs; OEMs become licensed distributors not competitors,Sub-threshold procurement entry: identify dept with budget authority <$50K; deliver disproportionate ROI on pilot,3-tier model enables enterprise scaling; Approval cascade = network effect flywheel; Parts library becomes key asset,None - highly validating mirror company; 100% aligned business model,EXTREMELY HIGH - Direct peer/competitor discovery; proven business model; explicit partnership offer,"Follow-up after Engine Summit Toronto (April 1); Propose Polyunity QMS white-label license for O&G vertical; Steven said 'We can't afford to compete...need to raise all ships'"
55,André Simha,Mediterranean Shipping Company (MSC),Chief Digital & Information Officer,26-Feb-2026,Spare part supply centralized (Cyprus) but distributed pragmatically,DATA QUALITY is real blocker - not technology (AI/ML/blockchain myths),IoT deployed but under-utilized (still Excel-based operations),Blockchain hype ended - APIs won (DCSA pivoted EDI→APIs),TRUST is #1 ecosystem killer (TradeLens failed due to ownership not tech),Post-COVID supply chain shift real; Data quality blocker; Trust essential for adoption,None - all validations strong,EXTREMELY HIGH - C-level ecosystem validation; adoption lessons; macro thesis confirmation,"LinkedIn connection within 2 weeks; Request OEM supply chain referrals; Reframe message on supply chain resilience + localization not 3D printing tech"
56,Sheila Paterson,"NS Dept. of Energy & Natural Resources (Former COVE COO)",Director Strategic Priorities,27-Feb-2026,COVID supply chain fragility VALIDATED from policy level,OEMs may PREFER licensing model (removes non-core burden; maintains revenue),Government is NOT buyer but direction-setter and accelerator,Certification bodies are conservative; find buyer with certification pathway,IP security + QA = top two barriers (consistent across ALL interviews),COVID fragility; Platform model understood; OEM licensing preference; Government role clarity; 8 actionable programs,None,EXTREMELY HIGH - Policy ecosystem; 8 actionable programs; government role clarity,"COVE intro; H2O Conference June (HIGH); Engine Conference Toronto March (HIGH); NRC-IRAP (HIGH); Invest Nova Scotia; Lloyd's Register Foundation; Kyle Burton (COVE/Invest NS)""
